{
  "$schema": "http://json-schema.org/draft-07/schema#",
  "$id": "https://github.com/mosca200/rc-simulation-engine/schemas/golden_scene_manifest.json",
  "title": "Golden Scene Manifest",
  "description": "Machine-readable contract for reproducible visual benchmarks of the RC Simulation Engine renderer. v1 supports only runtime-configurable parameters verified against crates/app/src/render_app.rs. Future capabilities are documented separately in docs/architecture/rv2_vis0_visual_benchmark.md.",
  "type": "object",
  "required": [
    "schema_version",
    "scene_id",
    "description",
    "renderer",
    "scenery",
    "camera",
    "resolution",
    "exposure_ev",
    "aircraft",
    "warmup",
    "capture",
    "tags"
  ],
  "additionalProperties": false,
  "properties": {
    "schema_version": {
      "type": "string",
      "const": "1.1.0",
      "description": "Current supported GoldenSceneManifest contract version. Version 1.0.0 was the original VIS0-A contract; 1.1.0 is VIS0-C1B and requires explicit airborne altitude_m plus airspeed_mps."
    },
    "scene_id": {
      "type": "string",
      "pattern": "^[a-z][a-z0-9_]*$",
      "minLength": 3,
      "maxLength": 128,
      "description": "Unique identifier for this scene. Format: <category>_<scenario>_<variant>. Example: 'aircraft_acro_static_front'."
    },
    "description": {
      "type": "string",
      "minLength": 10,
      "maxLength": 1000,
      "description": "Human-readable description of what this scene tests or demonstrates."
    },
    "renderer": {
      "type": "object",
      "required": ["version"],
      "additionalProperties": false,
      "properties": {
        "version": {
          "type": "string",
          "enum": ["v1", "v2"],
          "description": "Renderer backend version. 'v1' = legacy, 'v2' = physical atmosphere/IBL. Maps to --renderer CLI flag."
        },
        "terrain_debug": {
          "type": "string",
          "enum": ["final", "albedo", "normal", "roughness", "macro", "detail"],
          "default": "final",
          "description": "Terrain debug visualization mode. Maps to --terrain-debug CLI flag. Values verified from TerrainDebugMode::from_label in crates/renderer/src/gpu.rs."
        },
        "vegetation_debug": {
          "type": "string",
          "enum": ["final", "lod", "culling"],
          "default": "final",
          "description": "Vegetation debug visualization mode. Maps to --vegetation-debug CLI flag. Values verified from VegetationDebugMode::from_label in crates/renderer/src/vegetation.rs."
        }
      },
      "description": "Renderer configuration. Only runtime-configurable parameters."
    },
    "scenery": {
      "type": "object",
      "required": ["preset"],
      "additionalProperties": false,
      "properties": {
        "preset": {
          "type": "string",
          "enum": ["none", "flying-field", "photo-field"],
          "description": "Scenery preset. Maps to --scenery CLI flag. 'none' = empty, 'flying-field' = RC airfield with runway, markings, fence, windsock, 'photo-field' = PF1 presentation-only photographic field (real CC0 equirectangular panorama plus invisible depth proxies; requires the pilot camera). Values verified from SceneryPreset enum in crates/renderer/src/scenery.rs."
        }
      },
      "description": "Scenery environment configuration. Only runtime-configurable parameters."
    },
    "camera": {
      "type": "object",
      "required": ["mode", "vertical_fov_deg"],
      "additionalProperties": false,
      "properties": {
        "mode": {
          "type": "string",
          "enum": ["pilot", "chase"],
          "description": "Camera mode. Maps to --camera CLI flag."
        },
        "vertical_fov_deg": {
          "type": "number",
          "minimum": 10,
          "maximum": 120,
          "description": "Vertical field of view in degrees. Maps to --camera-fov CLI flag. Typical: 55-70."
        },
        "pilot_position_render_m": {
          "type": "array",
          "items": {"type": "number"},
          "minItems": 3,
          "maxItems": 3,
          "description": "Pilot camera position in render-body frame [x, y, z] in meters. Required when mode='pilot'. Maps to --pilot-position CLI flag (format: x,y,z)."
        },
        "chase_distance_behind_m": {
          "type": "number",
          "exclusiveMinimum": 0,
          "maximum": 50,
          "description": "Chase camera distance behind aircraft in meters. Required when mode='chase'. Maps to --chase-distance-m CLI flag."
        },
        "chase_height_above_m": {
          "type": "number",
          "minimum": -10,
          "maximum": 50,
          "description": "Chase camera height above aircraft in meters. Required when mode='chase'. Maps to --chase-height-m CLI flag."
        }
      },
      "allOf": [
        {
          "if": {"properties": {"mode": {"const": "pilot"}}, "required": ["mode"]},
          "then": {
            "required": ["pilot_position_render_m"],
            "not": {
              "anyOf": [
                {"required": ["chase_distance_behind_m"]},
                {"required": ["chase_height_above_m"]}
              ]
            }
          }
        },
        {
          "if": {"properties": {"mode": {"const": "chase"}}, "required": ["mode"]},
          "then": {
            "required": ["chase_distance_behind_m", "chase_height_above_m"],
            "not": {"required": ["pilot_position_render_m"]}
          }
        }
      ],
      "description": "Camera configuration. Mode-specific parameters are required based on the mode value, and fields from the wrong mode are rejected."
    },
    "resolution": {
      "type": "object",
      "required": ["width", "height"],
      "additionalProperties": false,
      "properties": {
        "width": {
          "type": "integer",
          "minimum": 320,
          "maximum": 7680,
          "description": "Image width in pixels."
        },
        "height": {
          "type": "integer",
          "minimum": 240,
          "maximum": 4320,
          "description": "Image height in pixels."
        }
      },
      "description": "Output image resolution."
    },
    "exposure_ev": {
      "type": "number",
      "minimum": -8,
      "maximum": 8,
      "description": "Manual exposure value in EV stops. Maps to --exposure-ev CLI flag. 0 = neutral, +1 = 2x brighter, -1 = 2x darker. Runtime range [-8, 8] verified from validate_exposure_ev in crates/renderer/src/gpu.rs."
    },
    "aircraft": {
      "type": "object",
      "required": ["model"],
      "additionalProperties": false,
      "properties": {
        "model": {
          "type": "string",
          "pattern": "^models/[a-z0-9_]+/model\\.json$",
          "description": "Path to aircraft model.json relative to repo root. Maps to --model CLI flag. Example: 'models/acro_electric_01/model.json'."
        },
        "throttle": {
          "type": "number",
          "minimum": 0,
          "maximum": 1,
          "default": 0.55,
          "description": "Engine throttle setting 0.0-1.0. Maps to --throttle CLI flag."
        },
        "altitude_m": {
          "type": "number",
          "exclusiveMinimum": 0,
          "maximum": 10000,
          "description": "Initial altitude above the render origin in metres (NED: the aircraft starts at position_world_m.z = -altitude_m). Required when the aircraft starts airborne, i.e. when start_on_ground is absent or false; forbidden when start_on_ground is true. Maps to --altitude-m CLI flag. Range (0, 10000] verified from MAXIMUM_ALTITUDE_M and the `<= 0.0 || > MAXIMUM_ALTITUDE_M` rejection in RenderOptions::parse_with_defaults (crates/app/src/render_app.rs). Runtime default when the flag is omitted: DEFAULT_ALTITUDE_M = 30.0 - a manifest must never rely on it."
        },
        "airspeed_mps": {
          "type": "number",
          "exclusiveMinimum": 0,
          "maximum": 200,
          "description": "Initial airspeed in metres per second along the body +x axis (linear_velocity_world_mps.x). Required when the aircraft starts airborne, i.e. when start_on_ground is absent or false; forbidden when start_on_ground is true. Maps to --airspeed-mps CLI flag. Range (0, 200] verified from MAXIMUM_AIRSPEED_MPS and the `<= 0.0 || > MAXIMUM_AIRSPEED_MPS` rejection in RenderOptions::parse_with_defaults (crates/app/src/render_app.rs). Runtime default when the flag is omitted: DEFAULT_AIRSPEED_MPS = 18.0 - a manifest must never rely on it."
        },
        "start_on_ground": {
          "type": "boolean",
          "default": false,
          "description": "Whether aircraft starts on ground. Maps to --start-on-ground CLI flag. When true, RenderApplication::new derives the initial state from supported_ground_start(&model) and never reads altitude_m/airspeed_mps."
        }
      },
      "allOf": [
        {
          "if": {
            "properties": {"start_on_ground": {"const": true}},
            "required": ["start_on_ground"]
          },
          "then": {
            "not": {
              "anyOf": [
                {"required": ["altitude_m"]},
                {"required": ["airspeed_mps"]}
              ]
            }
          }
        },
        {
          "if": {"not": {"required": ["start_on_ground"]}},
          "then": {"required": ["altitude_m", "airspeed_mps"]}
        },
        {
          "if": {
            "properties": {"start_on_ground": {"const": false}},
            "required": ["start_on_ground"]
          },
          "then": {"required": ["altitude_m", "airspeed_mps"]}
        }
      ],
      "description": "Aircraft configuration. Only runtime-configurable parameters. The airborne initial state is fully explicit: altitude_m and airspeed_mps are required unless start_on_ground is true, in which case the runtime ignores them and they must be absent."
    },
    "warmup": {
      "type": "integer",
      "minimum": 0,
      "maximum": 300,
      "default": 10,
      "description": "Number of frames to render before capture. Allows renderer to stabilize."
    },
    "capture": {
      "type": "object",
      "required": ["filename", "format"],
      "additionalProperties": false,
      "properties": {
        "filename": {
          "type": "string",
          "pattern": "^[a-z0-9_]+\\.(png|jpg|exr)$",
          "description": "Output filename. Must match format extension. Stable golden baseline format: <scene_id>_<width>x<height>.png (no timestamp). Example: 'aircraft_acro_static_front_1920x1080.png'."
        },
        "format": {
          "type": "string",
          "enum": ["png", "jpg", "exr"],
          "description": "Image format. PNG = lossless, JPG = lossy, EXR = HDR."
        },
        "frame": {
          "type": "integer",
          "minimum": 0,
          "description": "Specific frame number to capture. If omitted, captures frame after warmup."
        },
        "quality": {
          "type": "integer",
          "minimum": 1,
          "maximum": 100,
          "description": "JPEG quality 1-100. Only allowed when format='jpg'. Must be absent for png/exr."
        }
      },
      "allOf": [
        {
          "if": {
            "properties": {"format": {"const": "jpg"}},
            "required": ["format"]
          },
          "then": {},
          "else": {"not": {"required": ["quality"]}}
        }
      ],
      "description": "Capture configuration."
    },
    "tags": {
      "type": "array",
      "items": {
        "type": "string",
        "pattern": "^[a-z][a-z0-9_-]*$"
      },
      "minItems": 1,
      "maxItems": 20,
      "uniqueItems": true,
      "description": "Tags for categorization and filtering. Example: ['aircraft', 'acro', 'static', 'front-view']."
    },
    "reference_hardware": {
      "type": "object",
      "additionalProperties": false,
      "properties": {
        "gpu": {
          "type": "string",
          "description": "GPU model. Example: 'NVIDIA RTX 4090'."
        },
        "driver_version": {
          "type": "string",
          "description": "GPU driver version. Example: '546.33'."
        },
        "os": {
          "type": "string",
          "description": "Operating system. Example: 'Windows 11 23H2'."
        },
        "notes": {
          "type": "string",
          "description": "Additional notes about reference hardware setup."
        }
      },
      "description": "Reference hardware for which this baseline was validated. Optional. Should only be populated when a real approved baseline exists on that hardware."
    }
  }
}
