{
  "schema_version": "1.1.0",
  "scene_id": "pf1_occlusion_far",
  "description": "PF1 occlusion test case B: the Acro Electric 01 flown for 180 presentation frames so that, for ANY spawn heading, it is at least 70 m from the fixed photographic eye and therefore FARTHER than the 30 m tree-ring proxy while still far below its 53 deg top elevation, so the photographed tree line must hide it.",
  "renderer": {
    "version": "v2",
    "terrain_debug": "final",
    "vegetation_debug": "final"
  },
  "scenery": {
    "preset": "photo-field"
  },
  "camera": {
    "mode": "pilot",
    "vertical_fov_deg": 55,
    "pilot_position_render_m": [15.321, 1.6, -12.856]
  },
  "resolution": {
    "width": 1920,
    "height": 1080
  },
  "exposure_ev": 0.0,
  "aircraft": {
    "model": "models/acro_electric_01/model.json",
    "throttle": 0.8,
    "start_on_ground": false,
    "altitude_m": 8.0,
    "airspeed_mps": 30.0
  },
  "warmup": 180,
  "capture": {
    "filename": "pf1_occlusion_far_1920x1080.png",
    "format": "png",
    "frame": 180
  },
  "tags": ["pf1", "occlusion", "far", "photo-field"]
}
