{
  "schema_version": "1.1.0",
  "scene_id": "pf1_occlusion_near",
  "description": "PF1 occlusion test case A: the parked Acro Electric 01 at 20 m from the fixed photographic eye, i.e. NEARER than the photographed brick garage whose invisible proxy stands at 25.1 m, so the aircraft must render in front of the photographed building.",
  "renderer": {
    "version": "v2",
    "terrain_debug": "final",
    "vegetation_debug": "final"
  },
  "scenery": {
    "preset": "photo-field"
  },
  "camera": {
    "mode": "pilot",
    "vertical_fov_deg": 55,
    "pilot_position_render_m": [15.321, 1.6, -12.856]
  },
  "resolution": {
    "width": 1920,
    "height": 1080
  },
  "exposure_ev": 0.0,
  "aircraft": {
    "model": "models/acro_electric_01/model.json",
    "throttle": 0.0,
    "start_on_ground": true
  },
  "warmup": 30,
  "capture": {
    "filename": "pf1_occlusion_near_1920x1080.png",
    "format": "png",
    "frame": 30
  },
  "tags": ["pf1", "occlusion", "near", "photo-field"]
}
