{
  "schema_version": "1.1.0",
  "scene_id": "aircraft_acro_airborne_cruise",
  "description": "Canonical reference scene for Acro Electric 01 in airborne cruise, chase view. Companion to vis0_reference_scene.json: it exercises the airborne branch of RenderApplication::new, where the initial rigid-body state comes from altitude_m and airspeed_mps rather than from supported_ground_start. Both values are stated explicitly so the scene does not depend on DEFAULT_ALTITUDE_M or DEFAULT_AIRSPEED_MPS. This is a benchmark contract example, not an approved golden image.",
  "renderer": {
    "version": "v2",
    "terrain_debug": "final",
    "vegetation_debug": "final"
  },
  "scenery": {
    "preset": "flying-field"
  },
  "camera": {
    "mode": "chase",
    "vertical_fov_deg": 55,
    "chase_distance_behind_m": 3.5,
    "chase_height_above_m": 1.25
  },
  "resolution": {
    "width": 1920,
    "height": 1080
  },
  "exposure_ev": 0,
  "aircraft": {
    "model": "models/acro_electric_01/model.json",
    "throttle": 0.55,
    "altitude_m": 100.0,
    "airspeed_mps": 18.0
  },
  "warmup": 10,
  "capture": {
    "filename": "aircraft_acro_airborne_cruise_1920x1080.png",
    "format": "png",
    "frame": 10
  },
  "tags": ["aircraft", "acro", "airborne", "cruise", "chase-view", "benchmark"]
}
